{
  "schema_version": "1.0.0",
  "repo": {
    "platform_id": "b6b3b7b0-0000-4a11-9c2d-example00001",
    "owner": "some-org",
    "name": "some-public-repo",
    "full_path": "some-org/some-public-repo",
    "url": "https://sourcecraft.dev/some-org/some-public-repo",
    "clone_url": "https://sourcecraft.dev/some-org/some-public-repo.git",
    "description": "Example repository used to illustrate the collector output shape.",
    "visibility": "public",
    "default_branch": "main",
    "primary_language": "Python",
    "languages": { "Python": 0.82, "Dockerfile": 0.1, "Shell": 0.08 },
    "topics": ["example", "hackathon"],
    "created_at": "2025-02-10T09:00:00Z"
  },
  "collection": {
    "collected_at": "2026-09-19T12:00:00Z",
    "collector_version": "0.1.0",
    "duration_ms": 4213,
    "sources_used": {
      "git_clone": true,
      "platform_api": true,
      "platform_cli": false,
      "appsec_api": true
    },
    "category_status": {
      "documentation": "ok",
      "cicd": "partial",
      "security": "ok",
      "activity": "ok",
      "issues": "ok",
      "code_health": "ok"
    },
    "errors": [
      {
        "category": "cicd",
        "source": "platform_api",
        "code": "ENDPOINT_UNCONFIRMED",
        "message": "list_pipeline_runs path is unverified (see config/endpoints.yaml); skipped run-history fields for this record."
      }
    ]
  },
  "documentation": {
    "has_readme": true,
    "readme_length_chars": 3421,
    "readme_has_sections": ["installation", "usage", "license"],
    "has_license": true,
    "license_type": "MIT",
    "has_contributing": true,
    "has_code_of_conduct": false,
    "has_changelog": true,
    "has_docs_dir": true,
    "docs_file_count": 12,
    "has_issue_templates": true,
    "has_pr_template": false,
    "last_readme_change_at": "2026-08-01T00:00:00Z"
  },
  "cicd": {
    "has_ci_config": true,
    "ci_config_path": ".sourcecraft/ci.yaml",
    "declared_stage_count": 4,
    "has_test_stage": true,
    "has_lint_or_security_stage": true,
    "has_deploy_stage": true,
    "pipeline_history_available": false,
    "runs_30d": null,
    "success_rate_30d": null,
    "median_duration_seconds": null,
    "last_run_status": null,
    "last_run_at": null,
    "branch_protection_enabled": null
  },
  "security": {
    "appsec_available": true,
    "latest_scan": {
      "scan_uuid": "8f14e45f-ceea-4dab-8f5e-example00002",
      "status": "FINISHED",
      "scan_type": "SCAN_TYPE_DEFAULT",
      "finished_at": "2026-09-17T03:00:00Z"
    },
    "defect_groups_by_severity": { "CRITICAL": 0, "HIGH": 2, "MEDIUM": 5, "LOW": 10 },
    "defect_groups_by_engine_type": { "SAST": 12, "SCA": 4, "SECRETS": 1, "DAST": 0 },
    "defect_groups_by_status": { "OPEN": 17, "RESOLVED_FP": 3 },
    "open_defect_groups_total": 17,
    "resolved_false_positive_total": 3,
    "oldest_open_defect_group_age_days": 46.5,
    "has_security_policy": true
  },
  "activity": {
    "commits_30d": 45,
    "commits_90d": 130,
    "commits_365d": 600,
    "last_commit_at": "2026-09-19T08:00:00Z",
    "contributors_365d": 9,
    "bus_factor_top1_share_365d": 0.4,
    "branch_count": 6,
    "tag_count": 15,
    "pull_requests": {
      "open": 6,
      "merged_90d": 40,
      "avg_merge_time_hours": 18.5,
      "stale_open_count": 1
    },
    "releases": {
      "count": 15,
      "last_release_at": "2026-09-01T00:00:00Z",
      "median_interval_days": 21,
      "uses_semver": true
    },
    "likes": {
      "value": 54.5,
      "percentile": 2,
      "source": "platform_api:get_repo.rating"
    }
  },
  "issues": {
    "open_count": 22,
    "opened_90d": 35,
    "closed_90d": 30,
    "avg_time_to_first_response_hours": 12.4,
    "avg_time_to_close_hours": 96.0,
    "stale_open_count": 5,
    "unanswered_open_count": 3,
    "labels_in_use": ["bug", "enhancement", "documentation"]
  },
  "code_health": {
    "file_count": 214,
    "lines_of_code_estimate": 28000,
    "todo_count": 34,
    "fixme_count": 5,
    "hack_count": 1,
    "todo_density_per_kloc": 1.2,
    "oldest_todo_age_days": 402.0,
    "largest_file_lines": 1200
  }
}
